{
  "name": {
    "en": "Turnover into Sankaku-gatame"
  },
  "kind": "turnover",
  "techniques": [
    "sankaku-gatame"
  ],
  "about": {
    "en": "Against a partner defending on all fours: the attacker threads a leg triangle around head and arm from the side, then rolls them over their own shoulder into Sankaku-gatame. Senior material, because the finish is an armlock as well as a hold."
  },
  "keyPoints": {
    "en": [
      "Thread the leg past their neck and their near arm together",
      "Lock the triangle before you roll, not after",
      "Roll them over their shoulder, never straight onto their neck"
    ]
  },
  "described": {
    "en": [
      "Your partner is on hands and knees, head tucked, defending.",
      "From their right side, sit close to their shoulder and slide your right leg under their chest, past their neck and their right arm.",
      "Hook your right foot into the crook of your left knee, closing a triangle that traps their head and right arm.",
      "Take hold of their belt or far sleeve, tip your weight back and roll them over their right shoulder.",
      "They come over onto their back with the triangle still closed: you arrive in Sankaku-gatame on top.",
      "The trapped arm is a lock; tighten slowly and release the instant they tap."
    ]
  },
  "receiving": {
    "en": "A leg threads past your neck while you are turtled, and once it hooks you are rolled over your own shoulder with your head and one arm bound. Tuck and go with the roll rather than bracing your neck against it, and tap early once the triangle settles."
  },
  "videos": [
    {
      "provider": "akita",
      "platform": "youtube",
      "id": "WFPjiEYqXMM",
      "title": "Turnover into Sangaku gatameL",
      "duration": "2:06"
    }
  ]
}
